{
  "accepted": false,
  "accepted_at": "",
  "accepted_by": "",
  "account_id": "",
  "backend": {
    "checked_at": "",
    "environment": "",
    "name": "",
    "request_id": ""
  },
  "entitlements": [
    "commercial-use",
    "enterprise-support",
    "managed-policy"
  ],
  "license_key_fingerprint": "",
  "license_status": "missing",
  "notes": [
    "Example only. Replace with production account/license backend evidence before moving to docs/entitlements/<version>.json."
  ],
  "organization": "",
  "plan": "",
  "schema": "kiana.entitlement-proof.v1",
  "status": "blocked",
  "support_contact": "",
  "version": "0.1.0"
}
